key,0,1
132,TEXT_CTSOPN70WANDERINGMINSTREL_00897_WANDERINGMINSTREL_000_509,「未饜護龍　縛於銀白鎖刃<hex:02100103> 毀天滅地　築就吾之樂土」
133,TEXT_CTSOPN70WANDERINGMINSTREL_00897_WANDERINGMINSTREL_000_600,那麼今天要講述怎樣的冒險故事呢？
134,TEXT_CTSOPN70WANDERINGMINSTREL_00897_WANDERINGMINSTREL_000_601,充盈著雷屬性乙太的第九世界中，<hex:02100103>有一輛在昏暗的荒野中如閃電一般疾馳的列車，<hex:02100103>名叫「格萊楊拉波爾」……
135,TEXT_CTSOPN70WANDERINGMINSTREL_00897_WANDERINGMINSTREL_000_602,製造它的大國已經徹底毀滅，只剩名字。<hex:02100103>敵國與戰場的概念煙消雲散，運載的魔物自此無處可去。
136,TEXT_CTSOPN70WANDERINGMINSTREL_00897_WANDERINGMINSTREL_000_603,始發站已然毀滅，終點站亦已消失。<hex:02100103>迷茫的列車陷入失控，卻仍在軌道上一味地前進。
137,TEXT_CTSOPN70WANDERINGMINSTREL_00897_WANDERINGMINSTREL_000_604,被封印在車頭的魔法生物，<hex:02100103>究竟為何還要繼續前進呢？
138,TEXT_CTSOPN70WANDERINGMINSTREL_00897_WANDERINGMINSTREL_000_605,是為了完成他人賦予的使命，<hex:02100103>還是出於本能的戰鬥慾望？<hex:02100103>又或者……
139,TEXT_CTSOPN70WANDERINGMINSTREL_00897_WANDERINGMINSTREL_000_606,它只是單純想在機械徹底磨損，引擎失去動力之前，<hex:02100103>回到自己的家鄉林德布魯姆，回到如父如母的工程師身旁……
140,TEXT_CTSOPN70WANDERINGMINSTREL_00897_WANDERINGMINSTREL_000_607,那麼我來作詩一首吧。<hex:02100103>讓它在詩篇中奔向那早已消失，卻又夢想回歸的遙遠故鄉，<hex:02100103>奔向那與工程師們共度的往日時光吧。
141,TEXT_CTSOPN70WANDERINGMINSTREL_00897_WANDERINGMINSTREL_000_608,「無盡疾馳的列車運送生命，<hex:02100103>它從故鄉出發，只為贏取祖國的輝煌。」
142,TEXT_CTSOPN70WANDERINGMINSTREL_00897_WANDERINGMINSTREL_000_609,「無盡狂奔的列車屠戮生靈，<hex:02100103>它在大地衝撞，只為返回覆滅的故鄉。」
