key,11,12,13,14,93,94,95,96,97,98,99,100,101,102,103,104
#,VFX{Fire},VFX{Hit},VFX{Miss},VFX{Additional},Objective[0],Hint[0],Objective[1],Hint[1],,,,,,,,ActionText
offset,244,248,252,256,192,196,200,204,208,212,216,220,224,228,232,236
int32,str,str,str,str,str,str,str,str,str,str,str,str,str,str,str,str
1,,,,,,,,,,,,,,,,
2,,,,,,,,,,,,,,,,
3,,,,,,,,,,,,,,,,
4,ev_snipe_clic0f,,,,觀察長頸駝！,要想製作優質的標本，<hex:02100103>必須要仔細觀察活著的長頸駝。<hex:02100103>從上到下仔細觀察長頸駝！,,仔細觀察巨大的長頸駝全身,,,,,,,,觀察
5,ev_snipe0cf,ev_snipe_hit0f,ev_snipe_mis0f,,用吹箭射中所有的箭靶！,為了彰顯吹箭的可用性，<hex:02100103>用吹箭射中所有的箭靶！,,用吹箭射擊指定的箭靶,,,,,,,,放箭
6,ev_snipe_clic0f,,,,查看倒在沙灘上的人！,好像有人倒在了海邊，<hex:02100103>尋找那個人並確認其情況！,,查看倒下的人,,,,,,,,查看
7,ev_snipe0cf,ev_snipe_hit0f,ev_snipe_mis0f,,麻痺弗帕！,用塗有麻痺藥的吹箭麻痺弗帕！<hex:02100103>尋找弗帕，用吹箭射擊！,,用吹箭射擊弗帕,,,,,,,,放箭
8,ev_snipe0cf,ev_snipe_hit0f,ev_snipe_mis0f,,讓警戒中的帝國兵睡去！,用塗有催眠藥的吹箭<hex:02100103>讓警戒中的帝國兵睡去！<hex:02100103>尋找帝國兵，用吹箭射擊！,,用吹箭射擊帝國兵,,,,,,,,放箭
9,ev_snipe0cf,ev_snipe_hit0f,ev_snipe_mis0f,,讓警戒中的帝國兵睡去！,用塗有催眠藥的吹箭<hex:02100103>讓警戒中的帝國兵睡去！<hex:02100103>尋找帝國兵，用吹箭射擊！,,用吹箭射擊帝國兵,,,,,,,,放箭
10,ev_snipe0cf,ev_snipe_hit0f,ev_snipe_mis0f,,讓警戒中的帝國兵睡去！,帝國河畔堡前有警戒中的帝國兵。<hex:02100103>用吹箭射擊，讓其睡去！,,用吹箭射擊帝國兵,,,,,,,,放箭
11,ev_snipe_clic0f,,,,進行監視！,尋找疑似是叛徒的人，<hex:02100103>監視其一舉一動！,,進行監視,,,,,,,,監視
12,ev_snipe_clic0f,,,,進行監視！,尋找疑似是叛徒的人，<hex:02100103>監視其一舉一動！,,進行監視,,,,,,,,監視
13,ev_snipe_clic0f,,,,進行監視！,尋找疑似是叛徒的人，<hex:02100103>監視其一舉一動！,,進行監視,,,,,,,,監視
14,ev_snipe0cf,ev_snipe_hit0f,ev_snipe_mis0f,,讓羊睡去！,小羊羔逃離了羊群迷失了方向。<hex:02100103>為了捕獲膽小的小羊羔，<hex:02100103>用吹箭射擊，讓其睡去！,,用吹箭射擊迷路的羊羔,,,,,,,,放箭
15,ev_snipe_clic0f,,,,確認格格魯玖看到了什麼！,必須調查清楚格格魯玖看到了什麼。<hex:02100103>找到他看到的東西，進行確認！,失敗條件：確認到錯誤的目標,確認格格魯玖看到了什麼,,,,,,,,確認
16,ev_snipe1cf,ev_snipe_hit0f,ev_snipe_mis0f,,用戀愛水泡射擊魅力四射的斑鰩！,年輕的斑鰩想要吸引魅力四射的斑鰩，<hex:02100103>用戀愛水泡射擊使其回頭！,,用戀愛水泡射擊魅力四射的斑鰩,,,,,,,,射出戀愛水泡
17,ev_snipe_clic0f,,,,觀察蝦蛄並尋找弱點！,為了傳授與魔物戰鬥的方法，<hex:02100103>仔細觀察蝦蛄全身並尋找弱點！,,觀察蝦蛄的弱點,,,,,,,,觀察
18,ev_snipe_clic0f,,,,觀察弗巴德並尋找弱點！,為了傳授與魔物戰鬥的方法，<hex:02100103>仔細觀察弗巴德全身並尋找弱點！,,觀察弗巴德的弱點,,,,,,,,觀察
19,ev_snipe_clic0f,,,,尋找性情古怪的鯰魚精！,尋找性情古怪的鯰魚精進行觀察！,,尋找性情古怪的鯰魚精,,,,,,,,確認
20,ev_snipe_clic0f,,,,尋找性情古怪的鯰魚精！,尋找性情古怪的鯰魚精進行觀察！,,尋找性情古怪的鯰魚精,,,,,,,,確認
21,,,,,,,,,,,,,,,,
22,ev_snipe2cf,ev_snipe2_hit0f,ev_snipe2_hit0f,ev_snipe2_mis0f,驅除凶暴化的陀羅！,凶暴化的陀羅正在襲擊野營地，<hex:02100103>在陀羅們到達礦石以前砲擊所有的陀羅！,失敗條件：凶暴化的陀羅到達礦石,砲擊凶暴化的陀羅,,,,,,,,開砲
23,ev_snipe_clic0f,,,,尋找邦加莫南！,邦加莫南就在黎鐸拉納大燈塔的某處，<hex:02100103>找到他！,,找出邦加莫南,,,,,,,,確認
24,ev_snipe3cf,ev_snipe_hit0f,ev_snipe_hit0f,ev_snipe_hit0f,用箭射中靶子！,為了再現傳統弓射，用祭禮用的弓射出箭，<hex:02100103>命中魚信拿的靶子！,失敗條件：射中魚信,射中靶子,,,,,,,,放箭
25,ev_snipe3cf,ev_snipe_hit0f,ev_snipe_mis0f,,用箭射中靶子！,為了再現傳統弓射，用祭禮用的弓射出箭，<hex:02100103>命中鯰魚精拿的靶子！,,射中靶子,,,,,,,,放箭
26,ev_snipe0cf,ev_snipe_hit0f,ev_snipe_mis0f,,用吹箭射中豚豬！,為了獲得最適合製作武具的豚豬牙，<hex:02100103>尋找牙齒結實的豚豬，<hex:02100103>用吹箭射擊使其麻痺！,,射中豚豬,,,,,,,,放箭
27,ev_snipe_clic0f,,,,確認商品！,勒昂琅的蠕動食材店中<hex:02100103>擺滿了各類商品，<hex:02100103>確認所有商品！,,確認商品,,,,,,,,確認
28,ev_snipe_clic0f,,,,尋找石板！,給雅·修特拉的禮物<hex:02100103>似乎就藏在這個教會之中，<hex:02100103>找出古舊的石板！,,找出石板,,,,,,,,確認
29,ev_snipe_clic0f,,,,觀察壁畫！,雅·修特拉委託<hex:02100103>觀察古舊的壁畫，<hex:02100103>觀察所有的壁畫！,,觀察壁畫,,,,,,,,觀察
30,,,,,,,,,,,,,,,,
31,,,,,,,,,,,,,,,,
32,ev_snipe_clic0f,,,,尋找藍髮的貓秘族！,深藍色短髮的貓秘族似乎搶走了農作物。<hex:02100103>找出犯人！,,找出藍髮的貓秘族,,,,,,,,確認
33,ev_snipe_clic0f,,,,尋找神秘的人影！,來自神秘村莊的人物<hex:02100103>似乎正在窺探這邊的情況，<hex:02100103>找出神秘的人影！,,找出神秘的人影,,,,,,,,確認
34,ev_snipe0cf,ev_snipe_hit0f,ev_snipe_mis0f,,射擊戴著不同頭盔的矮人族！,現在進行圖爾找碴大作戰的練習，<hex:02100103>射擊與圖爾家族<hex:02100103>戴著不同頭盔的矮人族！,,射擊戴著不同頭盔的矮人族,,,,,,,,用彈弓射擊
35,ev_snipe0cf,ev_snipe_hit0f,ev_snipe_mis0f,,射擊戴著不同頭盔的矮人族！,現在正式進行圖爾找碴大作戰，<hex:02100103>射擊與圖爾家族<hex:02100103>戴著不同頭盔的矮人族！,失敗條件：射擊與圖爾家族戴著相同頭盔的矮人族,射擊戴著不同頭盔的矮人族,,,,,,,,用彈弓射擊
36,ev_snipe_clic0f,,,,尋找建築物的特徵！,調查形成<hex:02100103>鰭人潮池的建築物，<hex:02100103>尋找比較獨特的地方！,,找出獨特的外觀,,,,,,,,確認
37,ev_snipe_clic0f,,,,確認仙子族的數量！,要陪仙子族玩<hex:02100103>使用望遠鏡的遊戲了，<hex:02100103>尋找仙子族，確認其數量！,,確認仙子族的數量,,,,,,,,確認
38,ev_snipe0cf,ev_snipe_hit0f,ev_snipe_mis0f,,討伐古拉姆！,發射解咒器，<hex:02100103>討伐接近衛兵的<hex:02100103>古拉姆！,失敗條件：古拉姆接近衛兵,討伐古拉姆,,,,,,,,發射解咒器
39,ev_snipe_clic0f,,,,給采·努茲發送信號！,在不被塔羅斯發現的情況下<hex:02100103>給采·努茲發送信號！,失敗條件：采·努茲被塔羅斯發現,給采·努茲發送信號,,,,,,,,發送信號
40,ev_snipe4cf,ev_snipe4_hit0f,ev_snipe4_mis0f,,趕走靠近的東西！,投擲護身仙子豬<hex:02100103>趕走靠近採花的仙子的東西！,失敗條件：對方成功接近靠近採花的仙子,趕走靠近的東西,,,,,,,,投擲護身仙子豬
41,,,,,,,,,,,,,,,,
42,,,,,,,,,,,,,,,,
43,,,,,,,,,,,,,,,,
44,,,,,,,,,,,,,,,,
45,ev_snipe_clic0f,,,,給采·努茲發送信號！,在不被塔羅斯和周圍魔物<hex:02100103>發現的情況下<hex:02100103>給采·努茲發送信號！,失敗條件：采·努茲被塔羅斯或周圍魔物發現,給采·努茲發送信號,,,,,,,,發送信號
46,ev_snipe_clic0f,,,,確認M-017的異常反應！,為了確認M-017和主機的關係，<hex:02100103>在阿莉塞使用雷擊的瞬間<hex:02100103>確認M-017是否有異常的反應！,,確認M-017的異常反應,,,,,,,,確認
47,,,,,,,,,,,,,,,,
48,ev_snipe5ct,ev_snipe5_hit0t,ev_snipe5_mis0t,,使魔導巨兵停止行動！,利用魔導等離子球<hex:02100103>使魔導巨兵停止行動！,失敗條件：魔導巨兵接近救援隊的恆輝隊員,使魔導巨兵停止行動,,,,,,,,
49,ev_snipe6ct,ev_snipe6_hit0t,ev_snipe6_mis0t,,抓住奔行威！,在不妨礙其他兔兔族的前提下<hex:02100103>用肉丸擊中不停在說話<hex:02100103>還總是在奔跑的奔行威！,失敗條件：肉丸擊中驚慌失措的兔兔族,用肉丸擊中奔行威,,,,,,,,扔出肉丸
50,ev_snipe_clic0f,,,,觀察巨大的設備！,兔兔族們似乎<hex:02100103>對巨大的設備很感興趣，<hex:02100103>對具備特徵的部分進行觀察！,,觀察蘑菇狀結構,觀察儲罐似的結構,觀察筒狀結構,,,,,,觀察
51,ev_snipe0cf,ev_snipe_hit0f,ev_snipe_mis0f,,麻醉要捉的鳥！,為埃倫維爾提供幫助，<hex:02100103>尋找擁有綠色羽毛叫聲為咕哇的鳥，<hex:02100103>並使用麻醉針使其睡去！,失敗條件：麻醉其他鳥,麻醉要捉的鳥,,,,,,,,釋放麻醉針
52,ev_snipe_clic0f,,,,尋找形跡可疑的奧密克戎！,奧密克戎們正在待命，<hex:02100103>尋找違抗命令沒有待命的個體！,,尋找形跡可疑的奧密克戎,,,,,,,,確認
53,ev_snipe_clic0f,,,,觀察知識神像！,觀察知識神像的細節，<hex:02100103>聆聽眺望知識神像的男性講解，<hex:02100103>從中學習薩雷安的歷史！,,觀察知識神像的細節,,,,,,,,觀察
54,ev_snipe_clic0f,,,,確認兔兔族的數量！,參與「兔兔知多少」遊戲，<hex:02100103>尋找兔兔族並確認其數量！,,確認兔兔族的數量,,,,,,,,確認
55,ev_snipe_clic0f,,,,監視平原倉庫！,在平原倉庫目擊到了<hex:02100103>疑似本地人的青年，<hex:02100103>確認他的存在！,,確認疑似本地人的青年,,,,,,,,確認
56,ev_snipe0cf,ev_snipe_hit0f,ev_snipe_mis0f,,用吹箭讓興奮狀態的創造生物冷靜下來！,施加了睡眠咒法的吹箭<hex:02100103>能使興奮狀態的創造生物冷靜下來，<hex:02100103>用吹箭射擊興奮狀態的創造生物！,,用吹箭射擊創造生物,,,,,,,,放箭
57,ev_snipe_clic0f,,,,觀察希爾迪布蘭德！,為診斷昏睡狀態的希爾迪布蘭德，<hex:02100103>仔細觀察他的全身！,,仔細觀察希爾迪布蘭德的全身,,,,,,,,觀察
58,ev_snipe_clic0f,,,,尋找不明飛行物體！,在嘆息海南部目擊到了不明飛行物體。<hex:02100103>尋找不明飛行物體！,,找到不明飛行物體,,,,,,,,觀察
59,ev_snipe_clic0f,,,,調查有沒有異常情況！,在火牆調查有沒有異常情況！,,調查異常情況,,,,,,,,觀察
60,ev_snipe_clic0f,,,,觀察神轎！,觀察哈努族在節日中使用的神轎<hex:02100103>並調查破損情況！,,調查神轎,,,,,,,,觀察
61,ev_snipe_clic0f,,,,觀察釉藥工房內部！,為了推理出罐子工卡黑的願望<hex:02100103>觀察釉藥工房內部！,,觀察釉藥工房內部,,,,,,,,觀察
62,ev_snipe_clic0f,,,,尋找星戰士團的士兵！,尋找正在追蹤拉札罕正義俠的<hex:02100103>星戰士團的士兵！,,尋找星戰士團的士兵,,,,,,,,確認
63,,,,,,,,,,,,,,,,
64,ev_snipe_clic0f,,,,觀察躺著的士兵！,為了分析佐拉加軍的勢力<hex:02100103>觀察躺著的士兵！,,觀察躺著的士兵,,,,,,,,觀察
65,ev_snipe_clic0f,,,,觀察青磷水相關設備！,為了幫忙進行定期檢查<hex:02100103>觀察青磷水相關設備！,,觀察青磷水相關設備,,,,,,,,觀察
66,ev_snipe_clic0f,,,,觀察雙頭雕像！,為了了解瑪穆克<hex:02100103>觀察雙頭雕像的細節！,,觀察雙頭雕像的細節,,,,,,,,觀察
67,ev_snipe_clic0f,,,,尋找需要救助的人！,海岸附近有人溺水了，<hex:02100103>盡快找到需要救助的人！,,尋找需要救助的人,,,,,,,,觀察
