key,0
61,在此次計劃中，能夠完全滿足憧憬灣一帶所需動力的發電站可謂至關重要，無論是生活還是研究領域都堪稱生命線。要知道，這片土地在運營上並未依賴嘆息海據點中海德林大人賜予的近乎無限的乙太與理念。無論是建造新型發電裝置，還是日常維修材料都不可或缺。還請務必協助籌措維持發電站運轉所必需的各類物資。
62,為確保水產品養殖及參與計劃的亞伊太利斯人飲用水供應，供水站的建設至關重要。唉，血肉之軀的生物著實脆弱啊。為維持淨水清潔度，供水站內配置了多種運作系統。以地下水源抽水裝置中的淨化系統為例，其淨水裝置需定期更換。望貴方協助籌措用於加工淨水裝置的資源，並建立充足的物資儲備。
63,事實上，各類設備、月球車排氣系統及基地內的空調裝置均搭載了特殊的空氣淨化裝置，以避免對環境造成重大影響。雖說月球表面非常廣闊，但若不注重環境可持續性，未來登陸其他星球時又如何能尊重其獨特生態環境呢？淨化裝置的觸媒必須採用與環境高度相容的資源，自然需要就地取材。還請務必協助採集可作為觸媒加工的素材。
64,根據我方地質勘測結果顯示，憧憬灣區域極可能存在與地表傳承錄級採集物相媲美的特殊資源。如果得以確認，必將對後續探索計劃與技術發展產生深遠影響。雖能預想到採集過程絕非易事，但將根據目標物獲取過程的完成度予以重大評價。請務必做好萬全準備，全力應對此次挑戰。
65,在憧憬灣的若干水域，經過淡水化調控處理後，薩雷安的研究者們已成功放流從地錶帶來的水產品進行養殖實驗。通過在月面開展養殖實驗，可為未來星外環境中的食物供給開拓更多可能性。鑒於養殖實驗已持續一段時間，現需定期觀測水產品在月面水域的生長狀況。請協助採集足量樣本以供研究分析。
66,這片月面水域原本都是魔泉水質，而憧憬灣則通過中控水晶的環境調控，成功構建了淡水水域。至於仍保持魔泉特性的水域，是否有受到周邊地景改造的影響亦未可知。現需對各水域生態分布進行普查，同時對水產養殖環境的水質展開檢測，從而判斷自實驗啟動以來是否出現環境變異。請廣泛採集各類水產樣本以供分析。
67,這是月門基地食堂的緊急委託。目前負責供應全體計劃參與者餐食的基地食堂遭遇突發狀況，來自亞伊太利斯的定期食材運輸發生延誤，即將到來的供餐時段面臨原料短缺危機。若論憧憬灣即時可得的食材，當屬水產最為便利。請火速前往水域採集指定數量的水產品完成交付。此次行動亦可作為應對未來星外探索中同類突發狀況的預演訓練。
68,雖然為各類水產品種配備專用釣餌和擬餌最為理想，但要在宇宙飛船有限的載貨空間內攜帶足夠在新星球試驗用的大量釣餌實屬不易。今後，如何用單一釣餌獲取更多種類水產品的漁人技藝將愈發重要。為此，我們將結合各水域生態調查，開展一項特殊訓練，即在限定釣餌種類的情況下，測試能釣獲多少不同種類的水產品。
69,在資源有限的情況下推進探索計劃的我們眼中，大型水產品無論是作為食物還是加工原料都是極其重要的資源。同時，若能高效率地獲取這些資源，必將為整個計劃的推進成本做出重大貢獻。因此，希望那些以優秀漁師自居的計劃參與者們，能夠憑藉配給的有限釣餌施展技藝，盡可能地捕獲大型水產品。
70,稀有水產品即便數量稀少也具有極高的利用價值，對我們這些在此地籌劃探索計劃的人來說，是備受珍視的寶貴資源。但若為獲取其中一樣就耗費大量釣餌等資源，可就得不償失了。以一份投入換取百倍回報……這才是採集者的榮耀。希望貴方能與我們協力，挑戰用配給的少量釣餌能獲取多少高品質水產品。就請一展你作為漁師的本事吧。
71,從水產資源中獲取的素材，在我們的探索計劃中有著廣泛的用途，無論是做煉金藥還是調味料都不可或缺。其中某些珍貴部位或提取液，往往從單條魚身上只能獲取微量，但捕獲的水產品體型越大，可利用部位的總量就越是可觀。為設定確保充足素材獲取量的目標值，還請貴方以達成此等規格為目標進行水產採集。
72,憧憬灣因其與宙脈相通的特殊乙太環境，偶爾會出現受強烈環境影響而異常巨大的動植物。現欲針對某處水域的乙太值進行測量，調查其中生物體型相較物種平均尺寸能巨大到何種程度。請貴方在指定時間段內進行垂釣，並提交期間內捕獲的最大個體，以協助研究乙太濃度與生物個體生長的相關性。
73,月門基地正持續為星外活動儲備糧食與物資。部分素材此前一直從亞伊太利斯採購，但如果直接採購耐儲存食品和煉金藥的成品……咳咳，就是成本有點高……所以我們決定盡可能在月面就地籌措。可否請貴方在已確認資源的水域中，為我們採集更多高品質水產資源？
74,來自薩雷安的研究者們正在開展水產養殖的拓展研究，旨在調查水產生態並擴大其加工用途。若研究進展順利，或可在月面建立類似植物工廠的水產資源培育設施，這將極大便利未來的星際開拓活動。為拓寬研究對象種類，還請貴方前往指定水域，採集高品質的樣本以供研究。
75,憧憬灣的水域無論是淡水還是魔泉，似乎都孕育有種類繁多的水產品。尤為特別的是，與地表不同，由於這些水域不與海洋或河流相連，每個水域中都形成了極其獨特的生態系統。來自薩雷安的研究者們，似乎在開展星際探索之前就已經對這裡的研究著迷了！為滿足他們的研究需求，還請採集符合實驗目的的水產樣品，以供學術研究之用。
76,為確保水產品養殖及參與計劃的亞伊太利斯人飲用水供應，供水站的建設至關重要。唉，血肉之軀的生物著實脆弱啊。為維持淨水清潔度，供水站內配置了多種運作系統。以地下水源抽水裝置中的淨化系統為例，其淨水裝置需定期更換。望貴方協助籌措用於加工淨水裝置的資源，並建立充足的物資儲備。
77,根據無人機的空中生態掃描分析，數據顯示在特定水域中很可能棲息著尚未確認共生關係的水生生物。若能實地確認這些生物確實共存於同一水域，將為我們提供關於月面水產品種及水質分布的寶貴數據。在未來的星外探索中，無人機分析技術的實地研究應用預計將得到大規模部署運用。作為研究訓練的一環，可否請貴方協助獲取疑似存在共生關係的水產樣本？
78,目前正在研究棲息於魔泉中的水產品受環境影響所能達到的最大發育程度。通過比較生存於該魔泉中生物的平均體型與大型個體之間的差異，應該能夠確認魔泉中不規則的乙太波動對水產品造成的影響。由於憧憬灣外圍分布著多處魔泉，能否請貴方在指定地點採集合適的水產品樣本呢？
79,根據迄今為止在憧憬灣開展的調查研究，我們發現部分魔泉中很可能棲息著尚未被記錄的水產品種。目前僅能從現存物種的痕跡中略窺一二，其生態習性乃至捕獲方法幾乎完全未知。但若能成功確認，必將為我們的研究帶來重大突破。雖然預計採集工作絕不輕鬆，但我們將根據目標物的獲取過程進行重大評估。請務必做好萬全準備後再行挑戰。
80,
81,為了妥善保存水產資源，必須構建能夠再現採集地環境與水質的特殊容器。考慮到今後需要在星外環境中安全處理研究樣本，我們必須在月面先行開展充分的模擬實驗。現擬採用憧憬灣水域附近採集的素材，試製能夠長期完美保存該水域水質的大型容器。希望貴方能參考魔法大學使用的大型水槽設計，結合我方技術，準備一款兼具研究與運輸功能的水產專用大型集裝箱。
82,在星外探索任務中，由於宇宙飛船的物資運載能力有限，我們必須有效利用在各個探索地點獲取的當地資源來推進任務。因此，本次希望貴方能主要運用從憧憬灣採集的素材，而非依賴從亞伊太利斯運送的物資，進行試驗性工具的研製。這不僅能為今後的探索計劃設計提供參考，同時也能探究利用憧憬灣特有的素材能開發出何種工具，請務必鼎力相助。
83,這片憧憬灣原本就如嘆息海一般，既無海德林大人建造的遺跡，也感受不到人類的氣息與文明，完全是一片未經開墾的荒地。但用在此處採集的素材，真能製作出裝點人們生活的器具嗎？希望貴方能嘗試用採集到的素材，復現亞伊太利斯各地常見的鄉土器具。待確認安全性後，這些成品將作為星外活動中慰藉思鄉之情的物品，供眾人驗證其實用性。
84,在憧憬灣所發現的礦物與植被中，存在著諸多具有特異性質的品種。將這些素材運用於加工領域，必將為探索亞伊太利斯文明的技術潛力做出貢獻。最新研究發現，此地出產的礦物與纖維素材即便少量使用，亦含有對皮革與布料加工極為有效的成分。望貴方能以當地採集的素材作為觸媒，將皮革與布料加工成可供二次利用的複合素材。
85,根據最近的調查結果顯示，憧憬灣水域中沉積著具有極高稀有度的隕鐵、水晶及魚類分泌物等物質。可以推斷，這些水域作為長期存在於月面的魔泉，其特殊性質孕育了這些物質的獨特特性。由於含有特殊的乙太成分，這些素材具有極高的應用價值。若能妥善利用，預計將大大拓展各類產品開發的潛力。請將採集到的素材加工處理，轉化為便於作為二次原料使用的形態。
86,不用多說，在星外活動期間的糧食保障對人類而言至關重要。我們需要全面評估各種材料的可利用性，將其作為有益資源納入未來計劃。在憧憬灣可採集的物品中，有些雖可食用，但採集後極易變質。此次我們希望能探究其利用潛力。由於所含營養素十分理想，請務必在採集後立即進行烹飪和保存加工，將其製作成可長期儲存的食品。
87,受磁暴影響，穿行威隧道的設備似乎停運了。目前雖然已經啟動安全模式重新運作，但由於隧道內照明熄滅，嚴重影響了往來閃亮山內外的勘探活動進度，需盡快修復。<hex:02100103>據報告顯示，照明系統維修所需的材料和維護工具均出現短缺。希望貴方前往現場，完成必要物資的籌備。
88,受磁暴影響，承擔基地間物資運輸的月球車發生了故障。據報告，部分食品和絕緣材料等物資因此損毀。<hex:02100103>若物流延誤持續下去，可能會對整個項目進度造成負面影響。因此，希望各位能緊急籌措一批食品和物資以解燃眉之急。所需物資的集散地點定在主隕坑西側，拜託了。
89,在宇宙門關南部的滑石坑中觀測到大量乙太噴湧而出。目前地層狀態穩定，暫無連鎖坍塌風險。為此，我們提出了回收乙太作為資源利用的方案。<hex:02100103>現場已展開乙太回收作業，但因噴湧量遠超預期，急需補充儲罐及相關零部件。能否請貴方緊急調配所需物資？
90,受磁暴影響，據報告說有多架無人機在宇宙門關北部區域失控。目前推測這些無人機已墜落在該區域周邊。<hex:02100103>雖然多數無人機信號已消失，但若能及時回收機體並進行維修，仍有望能最大限度降低對整個計劃的負面影響。請協助搜索周邊岩層背側及水域等區域，完成無人機搜尋回收任務。
91,月門基地西南方向確認發生多顆小型隕石墜落，需立即清除以免影響周邊作業。部分隕石可能含有稀有金屬，應作為資源回收。<hex:02100103>目前現場已開始隕石破碎作業，但備用工具不足，請火速前往補充物資並回收有用隕石。
92,我們接到報告稱物資運輸中的月球車在流星的淚痕附近遭遇小隕石群，導致側翻故障。若放任不管，必將對物流計劃造成重大延誤。<hex:02100103>為此特批緊急預案，需立即趕赴現場製作修復月球車所需的金屬板與精密零部件。另外，若材料收集量超出需求，超額部分將作為後備物資用於其他方面。
93,在月底探索中的地下現場確認到異常氣體噴出。原因尚在調查中，推測可能與小型隕石撞擊有關。少量吸入似乎無害，但大量吸入的風險尚不明確。<hex:02100103>目前現場正在處理高濃度氣體積聚問題，但由於噴發量極大，安全清除所需的作業設備和防護裝備嚴重不足。請立即前往現場提供必要的物資支援。
94,在月底的地下現場確認到異常氣體大量噴出。部分地下作業人員因長時間暴露在氣體積聚區域，已出現頭痛、噁心等症狀，目前正轉移至月底北側接受治療。<hex:02100103>鑒於氣體持續噴發，出現異常症狀人數可能會進一步增加。請立即向現場運送治療藥及易於人體吸收的能量棒等物資加以援助。
95,受孢子霧影響，婚慶威的實驗園南側區域發現活性增強的劇毒變異菌類。為防止有毒孢子附著作業人員、周邊植物及星外探索船造成次生危害，現請求立刻展開消殺作業。<hex:02100103>現場作業人員已啟用火焰噴射器進行焚燒處理，但據報告，助燃劑、施工所需的防火布及防護裝備均出現短缺，請立刻調撥物資前往現場馳援。
96,受孢子霧影響的範圍似乎比預期更廣。據報告顯示，宇宙門關東北區域的植被及池塘生態系統已出現異常。雖未檢測到釋放毒素等惡性變異，但色素變化等異常現象的發展趨勢仍難以預測。<hex:02100103>請立即前往現場調查孢子霧影響情況，若具備生物採樣技術，請務必協助採集相關樣本。
97,在婚慶威的實驗園的繁茂的睡床區域附近確認發現變異仙人掌，推測是受孢子霧影響所致。問題在於其尖銳的針刺帶有毒性。<hex:02100103>由於對探索計劃構成阻礙，現場已開始用火焰噴射器進行清除作業，但接到報告稱設備和燃料不足，請立即籌措所需物資。
98,在婚慶威的實驗園的繁茂的睡床東側發現具有使用價值的特殊菌類。該菌類的菌絲組織異常堅韌且黏度極高，經加工後可製成適用於星外探索的強化布料，以及具備環境適應性的輕質高硬度建築材料。<hex:02100103>由於該特殊菌絲需採集後立即進行加工處理，現急需具備相關加工技術的人員趕赴現場提供支援。
99,用有限的材料製作指定數量的道具，<hex:02100103>製作出優質道具則提升評價。
100,用有限的材料製作指定數量的收藏品，<hex:02100103>根據收藏價值給予評價。
101,用有限的材料在限定時間內製作指定數量的道具，<hex:02100103>製作出優質道具則提升評價。
102,用有限的材料在限定時間內製作指定數量的收藏品，<hex:02100103>根據收藏價值給予評價。
103,在有限的採集地點採集指定數量的道具，<hex:02100103>根據獲得數量給予評價。
104,盡快獲得指定數量的目標道具，<hex:02100103>剩餘時間越多評價越高。
105,在限定時間內獲得指定數量以上的目標道具，<hex:02100103>根據獲得數量給予評價。
106,在限定時間內達成目標評價，<hex:02100103>根據連續成功次數給予評價。
107,在限定時間內達成目標評價，<hex:02100103>根據額外採集獎勵次數給予評價。
108,在限定時間內達成目標評價，<hex:02100103>根據連續成功次數或額外採集獎勵次數給予評價。
109,在限定時間內獲得目標收藏品，<hex:02100103>達成目標評價，<hex:02100103>根據收藏價值給予評價。
110,盡快獲得指定數量的目標精選成品，<hex:02100103>剩餘時間越多評價越高。
111,在限定時間內獲得目標道具，<hex:02100103>達成目標評價，<hex:02100103>根據數量與收藏價值給予評價。
112,在限定時間內獲得指定數量以上的目標精選成品，<hex:02100103>根據獲得數量給予評價。
113,盡快釣到幾種不同的水產品，<hex:02100103>剩餘時間越多評價越高。
114,盡快釣到指定數量的特定水產品，<hex:02100103>剩餘時間越多評價越高。
115,盡快釣到指定數量的任意水產品，<hex:02100103>剩餘時間越多評價越高。
116,用有限的釣餌釣到幾種不同的水產品，<hex:02100103>種類越多評價越高。
117,用有限的釣餌釣到盡可能大的水產品，<hex:02100103>達成目標評價，<hex:02100103>根據最大尺寸給予評價。
118,用有限的釣餌釣到收藏品，<hex:02100103>達成目標評價，<hex:02100103>根據收藏價值給予評價。
119,在限定時間內達成目標評價，<hex:02100103>根據大小給予評價。
120,在限定時間內釣獲盡可能大的水產品，<hex:02100103>達成目標評價，<hex:02100103>根據釣到的魚的最大尺寸給予評價。
121,在限定時間內釣獲盡可能多的水產品，<hex:02100103>達成目標評價，<hex:02100103>每條魚均給予評價，大尺寸則給予高評價。
122,在限定時間內釣獲盡可能多的收藏品，<hex:02100103>達成目標評價，<hex:02100103>根據收藏價值給予評價。
123,以採礦工採集素材道具，<hex:02100103>以刻木匠製作交貨道具，<hex:02100103>製作出優質道具則提升評價。
124,以採礦工採集素材道具，<hex:02100103>以鑄甲匠製作交貨道具，<hex:02100103>製作出優質道具則提升評價。
125,以採礦工採集素材道具，<hex:02100103>以雕金匠製作交貨道具，<hex:02100103>製作出優質道具則提升評價。
126,以採礦工採集素材道具，<hex:02100103>以鍛鐵匠製作交貨道具，<hex:02100103>製作出優質道具則提升評價。
127,以採礦工採集素材道具，<hex:02100103>以製革匠製作交貨道具，<hex:02100103>製作出優質道具則提升評價。
128,以採礦工採集素材道具，<hex:02100103>以裁衣匠製作交貨道具，<hex:02100103>製作出優質道具則提升評價。
129,以園藝工採集素材道具，<hex:02100103>以製革匠製作交貨道具，<hex:02100103>製作出優質道具則提升評價。
130,以園藝工採集素材道具，<hex:02100103>以裁衣匠製作交貨道具，<hex:02100103>製作出優質道具則提升評價。
131,以園藝工採集素材道具，<hex:02100103>以烹調師製作交貨道具，<hex:02100103>製作出優質道具則提升評價。
132,以園藝工採集素材道具，<hex:02100103>以刻木匠製作交貨道具，<hex:02100103>製作出優質道具則提升評價。
133,以園藝工採集素材道具，<hex:02100103>以鑄甲匠製作交貨道具，<hex:02100103>製作出優質道具則提升評價。
134,以園藝工採集素材道具，<hex:02100103>以煉金術士製作交貨道具，<hex:02100103>製作出優質道具則提升評價。
135,以捕魚人釣獲水產品，<hex:02100103>以鍛鐵匠製作交貨道具，<hex:02100103>製作出優質道具則提升評價。
136,以捕魚人釣獲水產品，<hex:02100103>以煉金術士製作交貨道具，<hex:02100103>製作出優質道具則提升評價。
137,以捕魚人釣獲水產品，<hex:02100103>以雕金匠製作交貨道具，<hex:02100103>製作出優質道具則提升評價。
138,以捕魚人釣獲水產品，<hex:02100103>以烹調師製作交貨道具，<hex:02100103>製作出優質道具則提升評價。
139,在限定時間內採集指定數量的目標道具。
140,在限定時間內製作道具，<hex:02100103>達成目標評價，<hex:02100103>製作出優質道具則提升評價。
141,在限定時間內釣到指定數量的目標道具。
142,
143,
144,交納至指定存放點
145,在限定時間內無失敗製作指定數量的道具，<hex:02100103>製作出優質道具則提升評價。
146,在限定時間內無失敗製作指定數量的收藏品，<hex:02100103>根據收藏價值給予評價。
147,用有限的材料製作指定數量的道具，<hex:02100103>製作出優質道具則提升評價，根據收藏價值給予評價。
148,用有限的材料在限定時間內製作指定數量的道具，<hex:02100103>製作出優質道具則提升評價，根據收藏價值給予評價。
149,在限定時間內無失敗製作指定數量的道具。
150,法恩娜行星上蘊藏著豐富的優質玻璃資源。我們對採集後經過冶煉加工的原材料制定了宇宙探索計劃的專用標準，計劃將其用作設施建材、行星研究樣本以及運往月球的輸送樣本。若能將其反覆精煉，製成便於使用的標準錠，這些星球的特產必將孕育出獨具特色的玻璃製品。期待各位在持續改良的同時，能實現穩定的資源供給。
151,法恩娜行星上充斥著大量玻璃資源，有些採集到的玻璃塊中還含有稀有礦物。若能成功提取金屬資源，這些玻璃山脈也可能化作貴金屬礦脈。希望諸位務必嘗試從玻璃資源中提煉金屬。考慮到後續利用，若能以金屬塊或標準錠的形態提交將不勝感激。
152,出於通用性考量，從月球運入的部分物資仍然是未加工狀態。因此需要工匠們進行加工才能活用這些材料。本次任務就是委託各位將這類通用部件加工成宇宙飛線專用零件。為了加速計劃推進，若能足量儲備各類零件將大有助益。
153,我們策劃部為探索這顆星球準備了多種工具，但在採集、加工玻璃資源及推進基地生活的過程中，某些特定工具仍不可避免地出現了短缺。現需委託諸位工匠製作一批專業性較高的工具，其中部分工具專為特定作業設計。正如各位所知，工具優劣將直接決定作業效率。
154,該星球的玻璃資源蘊含多種礦物，不少會呈現獨特色澤，但過去因含量問題難以有效利用。不過，若能從中精煉出多元合金，情況將截然不同。為拓寬本地資源利用範圍，本次特委託試製合金樣本。期待這一小步能成為明日重大突破的基石。
155,關於已採集的玻璃資源，其應用研發正持續推進。目前可確認能用於無人機、天文望遠鏡等精密儀器的透鏡部件，若加工技術足夠精湛，亦可作為藝術工藝品的原料。望貴方在製作過程中反覆驗證，期待能產出高品質成品。
156,儘管有中控水晶在持續調控環境，法恩娜行星仍會頻繁出現極端天氣。因此戶外探索用具需兼具耐高溫、抗嚴寒、防雷擊等多元性能。請諸位工匠在兼顧耐久性、品質與便利性的前提下，製作指定部件。若能確保充足儲備，我方將不勝欣喜。
157,由於玻璃資源加工所需的高溫熔爐、以及應對寒帶氣候用的大型供暖設備等器械往往超出宇宙飛船的運載尺寸上限，目前尚無法足量供應。當務之急是在當地進行組裝與調配。為此我們將提供基礎建材，請諸位根據各部門需求製作熔爐與反應釜。願這些爐膛中燃起的火焰，終有一日能照亮我們探索計劃的征程。
158,儘管有中控水晶在持續調控環境，但受高空滯留的濃乙太雲影響，法恩娜行星仍頻發異常氣象。其中雷擊造成的損害尤為嚴重，現正於各探索區域加裝避雷裝置。為擴大防護範圍，亟需貴方協助提供追加部件。
159,每次寒流一來都會導致這一帶冷得離譜，連我們兔兔族都凍得炸毛，人類肯定更受不了吧？在處理完緊急狀況後，必須立刻取暖才行。所以想拜託你們趕製一批能快速啟動的取暖設備和沐浴裝置。只要備夠數量，大伙就不至於被凍成冰棍，馬上就能重新投入工作啦！
160,從大規模協同作業到小規模輕作業中，迷你工程車都發揮著重要的作用。然而其運作必需的能量罐消耗過快，目前備用庫存已瀕臨見底。現需貴方執行兩項要務：補充短缺的能量罐，以及製作戰略儲備器材。這些儲備在平時將作為應急電池蓄電，成為基地的重要戰備物資。
161,基地目前正跟隨從亞伊太利斯聘請的玻璃工藝專家學習材料加工技術，但專用工具嚴重不足，現需籌備從大型器械到精密工藝的全套玻璃加工專用工具。針對工藝複雜的項目，請實施階段性成果彙報機制，各工程節點完成後請立即提交進度報告，我方將根據階段性成品品質進行動態評估。
162,進入火山地帶必須滿足兩個條件：執行冷卻熔融玻璃大作戰，以及通過無人機從空中持續投放冷卻劑。此次投入的無人機是在憧憬灣機型基礎上的改良版，重點提升了耐熱性能與冷卻劑投放裝置容量。請各位負責製造本次改裝所需的特定部件。
