key,0
#,
offset,0
int32,str
0,
1,在這憧憬灣地區，月門基地正計劃建造多種實驗性設施，包括核心設施、長距離運輸系統宇宙飛線、居住艙等，旨在為太空探索與星外活動做準備，因此所需建材數量極為龐大。關於需求量最大的金屬板，考慮到未來星外開採及廣泛用途需求，我們制定了宇宙探索計劃專用規格。現希望按照指定規格籌集金屬板。
2,月精金礦雖是月球特有的礦物，但憧憬灣出產的礦石似乎具有更高的硬度。這種特性使其非常適合用於建造宇宙飛船及各類月面設施，因此我們希望今後能開發其用途，確保在計劃中充分加以利用。為便於基於統一規格展開研究，能否請貴方將採集的原礦加工成標準錠，並建立充足的儲備？
3,在宇宙探索計劃中雖然投入了多種設備運行，但若為每台設備單獨配備專用部件，將會給現場管理帶來巨大負擔。為此，我們原則上對所有部件都採用統一規格標準。此次報告提及的短缺部件——包括設備接合部件、驅動部件等施工急需品——均屬於高優先順序物資。請務必按指定規格進行生產，並確保充足的庫存儲備。
4,由於這畢竟是一項大規模工程，包括損耗工具的更換在內，經常出現無法為作業人員配齊完好工具和工作服的情況。長此以往，恐怕會對作業品質和團隊士氣造成影響。因此希望貴方協助籌集當前緊缺物資，尤其是工具類物品。我們期待通過使用嶄新精良的工具，能夠提升計劃參與者的作業效率。
5,多虧研究團隊的活躍表現，我們在流星的淚痕發現的隕石中檢測到了多種有益礦物。但是也從素材中檢測出了特殊反應，狀態似乎不太穩定。若要將其作為資源利用，還需要進行精細加工。希望貴方作為熟練工匠對這些原礦進行處理，在謹慎觀察的同時妥善加工驗證。若驗證成功，或許能開闢出一條新資源的利用之路。
6,這似乎是薩雷安這個國家的固有特點——參與宇宙探索計劃的新成員來自形形色色的地區。嗯，即便想在設施中營造亞伊太利斯的特色，僅僅引入某個特定地域的文化也遠遠不夠。所以為改善居住環境，希望貴方能重現亞伊太利斯各地的特色家具。即便每個地區只能少量配置，也要盡可能廣泛地涵蓋各地方特色。此事雖費工夫，但還請多多用心。
7,此次希望驗證使用月球可獲取的各類資材能達到何種精密加工水平。姑且以亞伊太利斯的工藝品為參考基準，但若能實現精密加工技術的應用，相信對今後計劃內的加工作業也將大有裨益。同時，若能將這些加工品用於改善月門基地內的居住環境，必將取得更佳成效。請務必在確保部件精度的前提下，對材料進行精密加工並施以精妙紋飾。
8,雖然月面同樣沐浴著陽光與星輝，但與擁有漫射大氣層的地表相比，難免顯得昏暗幾分。然而為了盡可能為計劃參與者們提供與地表同等的工作環境，我們擬在包括月門基地周邊在內的本次作業全域，推進照明設備的完善工作以確保照度。我們已制定好各區域照明裝置的安裝方案，不知可否委託貴方負責籌集設備？
9,從地表新加入的多名計劃參與者針對憧憬灣的作業環境，提出了「寒冷、昏暗、不便」等抱怨與改善訴求。雖然我們希望參與者能暫且忍耐部分不便，但所有改善訴求均為值得重視的寶貴意見。作為計劃方，我們理應致力於營造舒適的工作環境。為全面提升所有參與者的作業環境，望能配備輔助各項作業的新設備與器材。
10,通過月底地下空間的勘探，已確認存在可作為地下資源的液態及氣態燃料。若能對這些資源展開研究並開發應用方向，無疑將為後續計劃帶來顯著助益。請立即籌集必要容器及儲罐，以便將採集到的液態與氣態物質密閉保存，並安全運輸至主要研究中心——月門基地。
11,當前月門基地等設施的室內裝修雖然採用了我們推薦的基礎建材，但現已發現這些材料在未知的星外環境中的結構強度存在隱患，該問題已被列為計劃推進的重要課題。為徹底解決此問題，擬將現有裝潢材料全面更換為硬度與耐久性更具保障的新型設計建材。不知可否委託貴方重新製作適用於基地設施及宇宙飛船內部的加固金屬隔斷與內裝材料？
12,隨著計劃推進，管理備品數量、基地駐留人員以及使用區域面積均呈指數級增長。有鑒於此，現需委託貴方承製月門基地周邊規劃部署的大型設施，具體包括：大型倉儲設備、作業平台及照明系統等關鍵物資的籌備與建造。針對大型資材或工藝複雜的項目，請實施階段性成果彙報機制，各工程節點完成後請立即提交進度報告，我方將根據階段性成品品質進行動態評估。
13,現正式委託貴方承製月門基地擴建項目所需的大型科研及生活保障設備，並配套製作備用維修部件。本次重點籌備對象包括：大型蓄水池、保險櫃及自動售貨機等設備。鑒於此類設備對運行精度有嚴格要求，務必確保製造工藝絕對可靠。待貴方完成所有精密加工工序後，因涉及重型設備運輸，將由我方專業工程團隊負責最終就位安裝。
14,正如貴方所知，我們正以星外探索為核心項目推進新型宇宙飛船的建造工程。現特此委託貴方研製飛船外裝主材的硬質合金，該材料將同時用於航行耗材及維修儲備。鑒於飛船需沿宙脈飛行，所供合金必須具備在乙太強流中穿行也能保持物性穩定的特性。請按宇宙飛船技術規範要求，加工製作專用硬質裝甲板及配套組件。
15,在月球及未來探索的未知星球上，地表預計將存在各類障礙地形。能在此時大顯身手的正是無人機！不僅限於物資運輸，對於人員難以抵達的複雜地貌，我們更期待通過高空精密偵查實現全方位勘察。為滿足多功能拓展需求，可否請貴方提供無人機定製化改裝所需的各類專用組件？
16,根據傳承錄記載，地面與嘆息海地區存在若干極為稀有的特殊物質。最新勘探顯示，憧憬灣同樣發現了傳承錄級別的珍稀素材，現需以其為原料研製可推動探索計劃突破性進展的尖端裝備。鑒於稀有素材加工難度極高，請務必做好萬全準備後再行著手。我們將配發作業用特殊效果發生裝置，因使用次數有限，請嚴格把握最佳啟用時機。
17,誠然，我們的計劃目標是宇宙探索，但小至參與者制服與工作服，大至居住艙內各類陳設，諸多領域仍需要大量使用亞伊太利斯常見的非金屬類素材，這些材料同樣是不可或缺的戰略資源。鑒於基礎素材需求量龐大，總部將實行統一調配管理，因此我們制定了宇宙探索計劃專用規格。現希望按照指定規格籌集非金屬基礎材料。
18,希望從月球表面存在的植物類資源，以及從亞伊太利斯運來的，棲息於伊爾薩巴德北部地區的魔物衍生資源等素材中，調配用於宇宙探索計劃的新型紙張和纖維。雖然研究成果基本以數據形式管理，但部分需作為提交魔法大學的保管文件，因此仍需準備紙質版本。故而，若有可能，希望盡量提供不易劣化的材質。
19,能否為我們準備用於居住艙及設施內部裝潢的內裝材料？目前，生活空間的內裝施工已採用我們推薦的基礎素材推進，但計劃參與者的偏好因人而異，似乎需要更多樣化的選擇。考慮到未來月面生活將長期持續，作為計劃機構提供的福利措施之一，我們希望準備多種內裝材料，以供自由選擇。
20,據報告，在遠離月門基地的區域進行作業時，必須的後勤支援物資目前處於短缺狀態。若在憧憬灣內作業，或許尚不至於孤立無援，但一旦進入外星環境，物資短缺將直接威脅人員的生命安全。因此，我們希望從月面準備階段起，便確保充足的物資儲備。能否協助籌集以下必需品？比如傷員病患專用的急救工具，防寒設備所需的燃料等。
21,多虧研究團隊的活躍表現，我們在婚慶威的實驗園中發現的新品種植被中檢測到了多種有益樹脂和纖維。但是也從素材中檢測出了特殊反應，狀態似乎不太穩定。若要將其作為資源利用，還需要進行精細加工。希望貴方作為熟練工匠對這些原材料進行處理，在謹慎觀察的同時妥善加工驗證。若驗證成功，或許能開闢出一條新資源的利用之路。
22,為了推進新素材的開發，我們認為有必要利用從憧憬灣採集的資源製成新素材，將其實際加工為實用品進行驗證。目前新素材的安全性驗證已完成，並已確認對人體無害，這一點敬請放心。請使用新素材試製採集工具、工作服等加工驗證用品。若成品品質達標，我們將考慮在計劃內廣泛推廣採用該新素材的產品。
23,隨著計劃推進，從亞伊太利斯前來增援的人員每日陸續抵達，導致月門基地各處的物資補充似乎有些捉襟見肘。雖然都是些食堂餐盤和小件收納盒短缺這類瑣碎問題，但畢竟事關新成員的日常生活便利性，我們希望能盡量避免給他們帶來不便。還望協助籌集一批基地內的生活用品。
24,在亞伊太利斯，那因時間流轉而變換色調的蒼天，似乎有著能讓人精神安定的效果，然而在缺乏這般景緻的月面生活中，人們或許會在不知不覺間累積身心上的不適。因此為保障計劃參與成員的健康福祉，我們準備完善休息區域的設施配置。不知可否協助籌備一些休憩空間必需品，諸如符合人體工學的舒適座椅和採用柔軟材質製成的寢具與靠墊等等。
25,儘管眾多來自亞伊太利斯的工匠們匯聚於此參與宇宙探索計劃，但其中不乏因從熟悉的作業環境遷至月面而倍感不適者。如果對這種情況放任不管，最後很可能會影響到作業效率與成品品質。為盡可能將工匠們的作業環境改造為能喚起地表安寧感的場所，可否請貴方籌備一批用於完善製作活動與作業空間的器具？
26,由於這畢竟是一項大規模工程，包括損耗工具的更換在內，經常出現無法為作業人員配齊完好工具和工作服的情況。長此以往，恐怕會對作業品質和團隊士氣造成影響。因此希望貴方協助籌集當前緊缺物資，尤其是輔助作業用的工具和工作服這類物品。我們期待通過使用嶄新精良的工具，能夠提升計劃參與者的作業效率。
27,隨著計劃推進，我們兔兔族當初的物資預算中未涵蓋的物品逐漸顯露出短缺。主要包括設施建設中不可或缺的大型備品，以及預防作業突發事故的安全防護裝備等等。鑒於貴方深諳這些物品的技術規格，特此委託製作。另外，這些裝備需同時適應高空作業與隧道內和地底勘探等地下作業要求，若具備高耐用性與多環境適配性則是最理想的狀態。
28,希望委託貴方籌集計劃用於月門基地周邊配置的設施材料，以及在廣域範圍內鋪設宇宙飛線所需的物資。由於宇宙飛線在憧憬灣完成運行驗證後，還將繼續應用於星外環境，因此相關材料不僅需要在月面進行儲備，更希望能提前充足備貨，為今後的需求做好準備。針對大型資材或工藝複雜的項目，請實施階段性成果彙報機制，各工程節點完成後請立即提交進度報告，我方將根據階段性成品品質進行動態評估。
29,研究部門近來頻頻提出關於基地內設備和材料短缺的改善要求。雖說部分原因在於我們預見不足，計劃進展順利反而導致物資周轉不靈，但研究部門的工作停滯意味著整個項目的停滯，必須盡快解決。所需物資種類繁多，既有易籌集的輕量物品，也有費時費力的大型設備。不知能否根據各項需求代為籌備合適的物資？
30,參與本計劃的研究者們的祖國似乎有一種名為咖啡館的休閒餐飲場所。在收集了各方同仁的參考意見後，我們考慮在月門基地內為計劃參與者完善一處能夠放鬆身心的休閒設施。根據收集的資訊分析，除了提供咖啡茶飲外，一個理想的放鬆空間還需要其他要素，比如被大量書籍環繞的靜謐環境以及令人安心的舒適家具……不知能否協助籌備相關物品？
31,在月球表面運輸物資主要依靠月球車進行大型輸送，但由於需要在崎嶇不平的月表地形上長途跋涉，所以必須對物資進行妥善保護以防破損。因此，希望此次能充分準備用於物資運輸的包裝材料。鑒於需要包裝的物資種類不同，每次都需要根據材質和大小選用相應的包裝材料，所以能否根據現場需求，代為籌備最合適的包裝材料及相關物資？
32,根據傳承錄記載，地面與嘆息海地區存在若干極為稀有的特殊物質。最新勘探顯示，憧憬灣同樣發現了傳承錄級別的珍稀素材，現需以其為原料研製可推動探索計劃突破性進展的資材與工作服。鑒於稀有素材加工難度極高，請務必做好萬全準備後再行著手。我們將配發作業用特殊效果發生裝置，因使用次數有限，請嚴格把握最佳啟用時機。
33,在憧憬灣各設施的施工過程中，我們急需大量用於穩固建築物地基的基材塊料，以及減少金屬材料磨損的潤滑油。為了加快整個區域的工程進度，確保這些基礎建材的穩定供應至關重要。考慮到未來星外開採及廣泛用途需求，我們制定了宇宙探索計劃專用規格。現希望按照指定規格籌集相關建材。
34,根據各施工現場收集的反饋意見，現決定對現有工程材料進行改良升級。若能獲得強度更高、施工性能更優的泥漿及建築黏合劑，將顯著提升設施的整體耐久性。考慮到未來星外開採及廣泛用途需求，我們制定了宇宙探索計劃專用規格。現希望按照指定配方要求，利用月面採集的原料研製這批改良建材。
35,對在嚴酷月面環境中直面隕石與菌絲威脅的作業人員，以及廢寢忘食持續探索未知的研究人員進行的健康掃描顯示，部分受驗者的營養平衡已出現嚴重紊亂。若不及時補充缺失的營養，其健康狀況恐將急劇惡化。我們已備齊充足的食材與營養劑，請貴方協助加工成便於補給的功能性食品。
36,在月門基地水產養殖過程中，我們發現某些水產品體內含有特殊營養體液，初步判斷可能具備延長食材保鮮期的特殊功效。為驗證其應用價值，請利用該原料試製能夠長期保存的藥品和耐儲存食品的樣本。這次的水產品可能是突然變異的品種，不過我們已經成功培養出了樣本，會同時提供它的體液作為材料。我覺得加工成食品或煉金藥應該都不錯，拜託啦。
37,由於來自亞伊太利斯地表的新人員還在陸續抵達，目前月門基地內與人類衣食住相關的物資已出現短缺跡象。因此，本次需對基地食堂及居住艙內的物品進行補充，並增加品類多樣性。隨著人員構成多樣化，為適應不同飲食偏好，分裝儲存食材的需求顯著增加。除餐具外，能否協助籌集分裝瓶和食材儲存罐這類烹飪相關容器？
38,在葫蘆小灣的水域中發現的新種水產品中，已檢測出多種有益物質。然而，這些物質性質極為脆弱，加工過程中易發生變質。換言之，若要將該水產品作為資源加以利用，必須確立一種能穩定提取有益物質的方法。為此，希望委託諸位熟練工匠驗證加工方法。請務必細心操作，謹慎處理。
39,在太空中，隨時都有可能發生無法預料的緊急情況。光是想想就令人毛骨悚然——比如說萬一宇宙飛船在宙脈中失去動力，就會漂浮在毫無依託的空間裡……唔。總之，為了防備這類緊急事態，除了開心胡蘿蔔外，我還想在宇宙飛船上儲備一些可長期保存的便攜食物。能否幫忙籌集一些富含高營養素的飲料和口糧呢？
40,對婚慶威的實驗園中繁殖的植物進行分析後，我們發現其具有極高的營養價值。據推測，以這種植物為原料，或許能製造出優秀的化妝品和食品，可是這種植物會散發出一種難以名狀的氣味。因此，我們希望貴方能傾盡所有技術手段，徹底去除其中的臭味成分，將其加工成能讓人安心使用的化妝品和食品。我們期待熟練工匠的精湛技藝。
41,對人類而言，在外太空環境中的長期活動是史無前例的，存在著諸多未知因素。特別是太空環境對精神層面會產生怎樣的影響尚不明確，我們認為必須進行細緻周到的心理關懷。因此，希望來自不同背景的協作者們能夠重現一些能讓人感受到「懷念」與「溫暖」的裝飾物品。不僅要注重視覺效果，還請用心營造能夠通過嗅覺來穩定情緒的氛圍。
42,據悉，在亞伊太利斯活動的冒險者們，在面臨重要戰鬥或精細作業前，都會通過食品或藥品來提升基礎能力值。若能常備這類具有特殊功效的物品，想必也能幫助我們應對計劃中可能遭遇的各種危機狀況。為了分發給宇宙探索計劃的協作者們，能否請貴方籌備一些具有提升工作效率效果的便攜食品和藥品？
43,在月門基地水產養殖過程中，我們發現某些水產品體內含有特殊營養體液。為驗證該營養素被人體攝取後能產生何種效果，並研究其應用方式，請將該體液加工成可供口服的形態。這次的水產品可能是突然變異的品種，不過我們已經成功培養出了樣本，會同時提供它的體液作為材料。我覺得加工成食品或煉金藥應該都不錯，拜託啦。
44,我們有意為在基地周邊作業的工作人員提供熱食補給和具有抗疲勞功效的生藥補給品，但若需面向全體作業人員大規模供應，則必須確保在足量製備的同時，還要保持有效成分和口感的均一性，這顯然是需要高超技藝的工作。針對大批量物資或工藝複雜的項目，請實施階段性成果彙報機制，各工程節點完成後請立即提交進度報告，我方將根據階段性成品品質進行動態評估。
45,我們兔兔族可是承蒙海德林大人恩賜，擁有萬年永動機能的魔法生物，不過說到底我們也是有心的生物，心情好壞可是會直接影響工作狀態的。所以想拜託大家幫忙準備些能安撫我們情緒的好東西，就像人類看到「綠油油樹林」或「藍汪汪大海」會覺得治癒一樣，能不能給我們做些熟悉的「灰濛濛世界」主題的改良品，還有我們最愛的胡蘿蔔味嗜好品。
46,我們正在推進憧憬灣採集水產品的養殖研究，但發現養殖品種似乎不太適應我們準備的飼料。雖然它們會進食，但健康掃描數據顯示，飼料效果並未達到預期數值。看來必須調配特殊配方的煉金藥，調整飼料的營養平衡，使其更符合養殖品種的偏好。因此，能否委託貴方利用附近採集的相容性素材，製作調整後的複合飼料？
47,月門基地食堂收到了計劃參與者們的請求，要在目前供應的餐食基礎上新增選單。聽說主要是薩雷安出身的人員想要一種極致的追求——既能高效補充能量又能快速完成攝取的料理。為了滿足這種需求，我們這邊已經構思好了成品的方案。這種餐食能夠實現嗎？我們會提供那種營養極限填充的食材，請務必製作出成品。
48,根據傳承錄記載，地面與嘆息海地區存在若干極為稀有的特殊物質。最新勘探顯示，憧憬灣同樣發現了傳承錄級別的珍稀素材，現需以其為原料研製可推動探索計劃突破性進展的煉金藥與完美食料。鑒於稀有素材加工難度極高，請務必做好萬全準備後再行著手。我們將配發作業用特殊效果發生裝置，因使用次數有限，請嚴格把握最佳啟用時機。
49,在某調查地點採集的樣本中，研究發現經過精選加工後可轉化為有用的素材。雖然單個樣本品質看似普通，但若能深入這項發現，或許能建立一套從未知採集物中高效獲取高價值資源的工藝流程！作為下一階段的目標，我們計劃拓展採集物的應用範圍研究，以及穩定為製作工序提供原料。請按我方制定的路線圖，協助完成樣本採集工作。
50,本次任務將重點考察作業效率，通過實踐測試驗證計劃可行性。我們將通過統計手段，測定在最短時間內能採集到指定數量素材的具體耗時，以此獲取具有參考價值的數據指標。此外，我們也期待能由此產生群體效應，將優秀作業者達成的數值作為全體成員的目標，從而提升整體工作積極性。
51,月門基地擴建及居住艙的建造維修工作，需要消耗大量資材。我們雖已制定從憧憬灣各地調運物資的預案，但要持續推進工程，確保資材高效供給才是關鍵所在。畢竟基地核心區強化勢在必行，為給宇宙探索計劃注入新動力，還請諸位協助者鼎力相助，共同完成資材的大規模籌措。望諸位助我們囤足物資儲備，拜託了。
52,此次希望貴方協助開展關於資源採集能力的技術驗證。請嘗試專注於在單一採集點連續成功採集，挑戰最大連續成功採集次數如何？我們將通過多功能無人機從空中拍攝記錄作業過程，以期提升未來工作的穩定性。若能獲得顯著數據成果，相信對今後計劃中的人員調度安排等亦將大有裨益。
53,此次希望貴方協助開展關於大規模資源獲取的技術驗證。在採集作業中，偶爾會出現單次採集量超出預期的現象，現已證實這與採集者的技術水平密切相關。因此，此次希望貴方能挑戰如何主動觸發這種現象。我們將通過多功能無人機從空中拍攝記錄作業過程，深入研究其觸發機制。
54,在這次計劃中，憧憬灣的地質調查可是具有極其重要戰略意義的任務。這個長期以來連我們兔兔族都還沒充分開發過的隕坑，至今仍存在大量未勘探地帶。請按照我們標註的坐標點進行巡迴採樣。通過對採集資源樣本的充分數據分析，或許能獲得揭示月球整體資源分布規律的關鍵線索。
55,在採集作業中，不能僅憑外觀形態簡單收集同類資源，更需要具備甄別材質優劣的眼光，精選上乘素材。畢竟優質原料的運用，直接關係到高階製作活動的成敗與成品品質。本次所需資源，恰似沙中淘金——重在質而不在量。還請貴方發揮真本領，務必精挑細選，採集來極品素材。
56,隨著令人矚目的開發進展，憧憬灣西南部的閃亮山內周區域的隧道已成功貫通！無人機先期掃描調查證實，該地區極可能蘊藏著新型可用資源。為此，我們將基於無人機影像數據展開分析，同步進行資源儲量調查與實體樣本採集工作。相信所獲樣本與數據必將為後續區域勘探開發計劃提供重要依據。
57,隨著令人矚目的開發進展，憧憬灣東北部的月底地區，可直達地底的升降機正式開通。該區域更接近月球核心，現有研究表明其可能受到佐迪亞克的殘留乙太的強烈影響。由於地下環境閉塞導致無人機活動困難，加之前期勘探不充分，希望貴方能協助進行地質調查及資源回收工作。若能獲取更優質的資源則尤為理想。
58,在憧憬灣西北及東南外圍區域，已確認蘊藏著大量稀有高價值資源，但是採集難度很高。這些資源樣本很可能受到隕坑形成時墜落到月球的隕鐵影響，其耐久性的測試數據表現優異，對正在開發的宇宙飛船及精密儀器而言不可或缺。希望貴方盡快回收優質素材，並完成稀有資源提取工作。
59,在憧憬灣一帶，已發現多種雖不適合作為製造主材，卻對加工工藝具有顯著輔助效果的特殊素材。由於材料加工無法僅依賴單一成分，這些同樣是月球開發中不可或缺的重要資源。即便在星外探索中，亦存在需要就地獲取輔助材料的情況。望貴方儲備足量優質品類，確保隨時可用。此外若在採集過程中發現具有較高應用價值的特殊素材，將根據其品質另行追加評估獎勵。
60,月門基地周邊區域由於物資運輸較為便利，作為通用材料的採集地點一直備受重視。然而從地形保護和植被維護的角度考慮，過度依賴這些場所並非上策，因此希望貴方能協助進行現有資源埋藏量調查，並開拓新的採集地點及相關調查工作。現已標註出現有採集點及新開拓地點的備選位置，請前往各處巡查並採集足夠的調查樣本。
